[
  {
    "claim_id": "C001",
    "claim_text": "GPAI obligations under Articles 53–55 entered application on 2 August 2025, with systemic-risk provisions applying to models above the 10^25 FLOPs threshold.",
    "section": "Executive summary",
    "supporting_source_ids": ["S001", "S002"],
    "contradicting_source_ids": [],
    "admiralty_credibility": 1,
    "label": "CONFIRMED",
    "corroboration_count": 2,
    "independent_tier12_count": 2,
    "primary_source_present": true,
    "notes": ""
  },
  {
    "claim_id": "C002",
    "claim_text": "The Article 2(5g) open-source exemption excludes free and open-source GPAI models from several transparency obligations unless they meet the systemic-risk threshold, in which case the exemption does not apply.",
    "section": "Executive summary",
    "supporting_source_ids": ["S001", "S003"],
    "contradicting_source_ids": [],
    "admiralty_credibility": 1,
    "label": "CONFIRMED",
    "corroboration_count": 2,
    "independent_tier12_count": 2,
    "primary_source_present": true,
    "notes": ""
  },
  {
    "claim_id": "C003",
    "claim_text": "The European AI Office's Code of Practice was published on 2025-07-10 and operationalizes Article 53 transparency requirements including the sufficiently-detailed-summary of training data.",
    "section": "Executive summary",
    "supporting_source_ids": ["S002", "S005"],
    "contradicting_source_ids": [],
    "admiralty_credibility": 1,
    "label": "CONFIRMED",
    "corroboration_count": 2,
    "independent_tier12_count": 2,
    "primary_source_present": true,
    "notes": ""
  },
  {
    "claim_id": "C004",
    "claim_text": "Article 53 imposes on GPAI providers the obligation to publish a sufficiently detailed summary of training data, maintain technical documentation, and cooperate with downstream deployers.",
    "section": "1. GPAI provisions in force in 2026",
    "supporting_source_ids": ["S001", "S004"],
    "contradicting_source_ids": [],
    "admiralty_credibility": 1,
    "label": "CONFIRMED",
    "corroboration_count": 2,
    "independent_tier12_count": 2,
    "primary_source_present": true,
    "notes": ""
  },
  {
    "claim_id": "C005",
    "claim_text": "Article 2(5g) exempts free and open-source GPAI models from transparency requirements of Articles 53(1)(a) and (b) only when parameters, architecture details, and usage information are publicly available; exemption is void above the systemic-risk threshold.",
    "section": "2. The open-source exemption (Article 2(5g))",
    "supporting_source_ids": ["S001", "S003"],
    "contradicting_source_ids": [],
    "admiralty_credibility": 1,
    "label": "CONFIRMED",
    "corroboration_count": 2,
    "independent_tier12_count": 2,
    "primary_source_present": true,
    "notes": ""
  },
  {
    "claim_id": "C006",
    "claim_text": "Meta has positioned Llama as compliant under Article 2(5g), Mistral has issued a European regulatory alignment statement, and HuggingFace released model-card templates aligned to the Code of Practice.",
    "section": "3. Provider responses",
    "supporting_source_ids": ["S006", "S007", "S008"],
    "contradicting_source_ids": [],
    "admiralty_credibility": 2,
    "label": "PROBABLY TRUE",
    "corroboration_count": 3,
    "independent_tier12_count": 3,
    "primary_source_present": false,
    "notes": "Three independent Tier 2 provider statements; no contradiction."
  },
  {
    "claim_id": "C007",
    "claim_text": "The scope of \"sufficiently detailed summary\" of training data under Article 53(1)(d) remains disputed: the Commission's July 2025 template is read by Meta as compatible with existing Llama disclosures, and by Mozilla as requiring substantially more granular dataset provenance than any current open-source release provides.",
    "section": "Contradictions & open debates",
    "supporting_source_ids": ["S005", "S006", "S009"],
    "contradicting_source_ids": [],
    "admiralty_credibility": 3,
    "label": "POSSIBLY TRUE",
    "corroboration_count": 3,
    "independent_tier12_count": 3,
    "primary_source_present": true,
    "notes": "Readings differ; axis expected to resolve after Q3 2026 Code of Practice clarifications (S011)."
  },
  {
    "claim_id": "C008",
    "claim_text": "Compliance costs exceed €1M for small open-source GPAI providers.",
    "section": "Needs Verification",
    "supporting_source_ids": ["S012"],
    "contradicting_source_ids": [],
    "admiralty_credibility": 6,
    "label": "UNVERIFIED",
    "corroboration_count": 1,
    "independent_tier12_count": 0,
    "primary_source_present": false,
    "notes": "Single Tier 3 trade-press source; no regulatory or independent analyst corroboration. Follow-up required from Gartner/McKinsey or Commission impact assessment."
  }
]
